{
  "investigation_id": "11111111-1111-4111-8111-111111111111",
  "attempt_id": "att_0123456789abcdef",
  "attempt_number": 1,
  "tenant_id": "tenant-acme",
  "org_scope": {
    "org_id": "org-tier1",
    "org_path": "acme/soc/tier1"
  },
  "requested_by": {
    "type": "user",
    "id": "membership-001",
    "tenant_id": "tenant-acme"
  },
  "run_status": "cancelled",
  "record_status": "closed",
  "version": 7,
  "last_checkpoint_sequence": 3,
  "updated_at": "2026-07-26T08:05:00Z",
  "terminal_at": "2026-07-26T08:05:00Z",
  "data_marking": {
    "classification": "confidential",
    "tlp": "TLP:AMBER",
    "handling": ["no-export"]
  }
}
